{
  "schemaVersion": 1,
  "repository": "OWNER/REPOSITORY",
  "workflowPhase": "PLANNING_IN_PROGRESS",
  "planRevision": "initial",
  "planBaseline": null,
  "selectedPlanCandidate": null,
  "lastRun": null,
  "hardeningReports": [],
  "openFindingIds": [],
  "plannerDisposition": [],
  "reviewReport": null,
  "humanApproval": null,
  "writeOwner": null,
  "nextAction": "Planungsauftrag und Ist-Baselines erfassen."
}
